August 2022 - September 2022;;;
Scientific Secondment;;;
German Aerospace Centre (DLR);https://www.dlr.de/at/en/desktopdefault.aspx/tabid-1549/2461_read-3834/;(Cologne - Germany);
DLRLogo.png;German Aerospace Centre (DLR) Logo;;
Within Marie Skłodowska-Curie Actions, a visit to DLR Transonic Cascade Wind Tunnel to study the unsteady measurement techniques for compressor cascades;;;
The objectives:;Calibration of Kulite probe and vibration sensors.;;
;Apply analysis on high Data Acquisition (DAQ) rates.;;
;Synchronized speed Schlieren setup.;;
